{"body":{"actor":{"key_id":"ed25519:sha256:bdf05ec0cd70191a1343dd4db0cd0c7b094794238a73e64bdcca06081053dd3a","label":"Harper Reed"},"authority_epoch":"phase-0-1-root-v1","frontier":[{"heads":["sha256:69d67237ecf856c5b72515cd1ac43322642a847c1fc0d35955cd30e911146743"],"namespace":"org/2389/pact"}],"metadata":{"producer":"pact-reference-cli/0.1.0","purpose":"Phase 2 bounded DAG index and query dogfood checkpoint"},"observed_at":"2026-08-25T02:54:59Z","policy_ref":"sha256:27ef52b038652366afcb48308326eca92da80c5598291ee0317454e3ab77fac0","previous_checkpoint":"sha256:2e97c1e773c4ff3c272ff736e2218c7c753946552d3e61b9d8f96fc1035d7e42","schema_refs":["sha256:14b5fb39a48736dafb104e6232b230799e1f2d2ce021b4c0f6385cf77d36cded"],"scope":"org/2389/pact"},"body_digest":"sha256:50d4da75e2531dc66dafcb4bd6b38ed5f4d05986f1f6c7204c980b25b9ef16f4","format":"pact/checkpoint/v1","signature":{"algorithm":"ed25519","key_id":"ed25519:sha256:bdf05ec0cd70191a1343dd4db0cd0c7b094794238a73e64bdcca06081053dd3a","public_key":"korKaY10s8dqSpqmcjbDon58VdDZSkcPro-lkbCC5cQ","value":"qGrbWVikFkCEDs0-QLuHb4Pns8-mFvqVaYeQItXNP5bXbAtYKlGNzZg9hgL3WbZwr9Mp8_Px1roC_f6XgWtkBQ"}}