{"body":{"actor":{"key_id":"ed25519:sha256:bdf05ec0cd70191a1343dd4db0cd0c7b094794238a73e64bdcca06081053dd3a","label":"Harper Reed"},"authority_epoch":"phase-0-1-root-v1","frontier":[{"heads":["sha256:5e7cf3a370a15ba838200ecef9fc8927a3855f3d27216466f1a5182598d804ce"],"namespace":"org/2389/pact"}],"metadata":{"producer":"pact-reference-cli/0.1.0","purpose":"Phase 0 and Phase 1 MVP dogfood checkpoint"},"observed_at":"2026-08-24T14:56:19Z","policy_ref":"sha256:27ef52b038652366afcb48308326eca92da80c5598291ee0317454e3ab77fac0","previous_checkpoint":null,"schema_refs":["sha256:14b5fb39a48736dafb104e6232b230799e1f2d2ce021b4c0f6385cf77d36cded"],"scope":"org/2389/pact"},"body_digest":"sha256:d4831e20daefe9769cf8b84bfd06d599693376f6299e9c13ce8288402e111832","format":"pact/checkpoint/v1","signature":{"algorithm":"ed25519","key_id":"ed25519:sha256:bdf05ec0cd70191a1343dd4db0cd0c7b094794238a73e64bdcca06081053dd3a","public_key":"korKaY10s8dqSpqmcjbDon58VdDZSkcPro-lkbCC5cQ","value":"GxGVQFFHlO2OfoUx7i4o6QGJy3Q0TB-uDYt2EfaY5JU3lUou0KXqJNlVUv6AA4hnkqEAjlXOwXoNZ2gpMVIaBQ"}}